{
  "$schema": "../../schemas/game-definition.schema.json",
  "id": "template",
  "displayName": "Template Game",
  "version": "0.1.0",
  "studio": "AetherSpin",
  "theme": "neutral",
  "description": "Generic 5x3, 10-line template. Clone this and tune the numbers for a new title.",
  "engine": { "type": "lines", "numReels": 5, "numRows": 3, "wincapMultiplier": 5000.0, "rtpTarget": 0.965, "volatility": "medium" },
  "currency": { "default": "USD", "apiAmountMultiplier": 1000000, "bookAmountMultiplier": 100 },
  "bet": { "defaultLevelIndex": 2, "levels": [0.1, 0.2, 0.5, 1.0, 2.0, 5.0, 10.0, 20.0, 50.0, 100.0], "minBet": 0.1, "maxBet": 100.0, "stepBet": 0.1 },
  "betModes": [
    { "name": "base", "cost": 1.0, "label": "Base Game", "isBuyBonus": false },
    { "name": "bonus", "cost": 100.0, "label": "Buy Free Spins", "isBuyBonus": true }
  ],
  "symbols": [
    { "id": "W", "name": "Wild", "kind": "wild", "color": "#ffffff", "substitutes": ["H1", "H2", "L1", "L2"] },
    { "id": "S", "name": "Scatter", "kind": "scatter", "color": "#ff00ff" },
    { "id": "H1", "name": "High 1", "kind": "high", "color": "#ffd166" },
    { "id": "H2", "name": "High 2", "kind": "high", "color": "#4dd0e1" },
    { "id": "L1", "name": "Low 1", "kind": "low", "color": "#26c6da" },
    { "id": "L2", "name": "Low 2", "kind": "low", "color": "#9ccc65" }
  ],
  "paytable": {
    "W":  { "3": 20, "4": 100, "5": 500 },
    "H1": { "3": 15, "4": 75,  "5": 375 },
    "H2": { "3": 10, "4": 50,  "5": 250 },
    "L1": { "3": 5,  "4": 20,  "5": 100 },
    "L2": { "3": 4,  "4": 15,  "5": 75 }
  },
  "paylines": [
    [1, 1, 1, 1, 1], [0, 0, 0, 0, 0], [2, 2, 2, 2, 2], [0, 1, 2, 1, 0], [2, 1, 0, 1, 2],
    [0, 0, 1, 2, 2], [2, 2, 1, 0, 0], [1, 0, 0, 0, 1], [1, 2, 2, 2, 1], [0, 1, 1, 1, 0]
  ],
  "scatter": { "symbol": "S", "minToTrigger": 3, "pays": { "3": 2, "4": 10, "5": 50 } },
  "features": {
    "freeSpins": { "enabled": true, "awards": { "3": 8, "4": 12, "5": 20 }, "retrigger": true, "winScale": 1.0, "multiplierLadder": { "description": "Global multiplier increments on a win.", "start": 1, "step": 1, "max": 3 } },
    "multiplierWilds": { "enabled": true, "appliesIn": ["free"], "values": [2, 3], "weights": [70, 30] },
    "expandingWilds": { "enabled": false, "appliesIn": ["free"], "description": "Disabled by default." },
    "bonusBuy": { "enabled": true, "mode": "bonus", "costMultiplier": 100.0, "description": "Buy the free spins feature." }
  }
}
